{
  "schema_version": "2.0.0",
  "recommendation_package_id": "recommendations-example-education",
  "protocol_id": "protocol-example-education",
  "audit_id": "audit-example-education",
  "recommendations": [
    {
      "recommendation_id": "rec-citation-official",
      "priority": "P0",
      "dimension": "citation_quality",
      "business_context": "职业院校嵌入式实训解决方案",
      "finding": "多条已观测回答没有提供品牌相关引用，引用源质量为当前最弱维度",
      "source_ids": ["src-official-home"],
      "observation_ids": ["obs-chatgpt-category", "obs-doubao-category", "obs-doubao-solution"],
      "hypothesis": "官网现有内容缺少可被回答直接引用的独立事实单元和结构化标记",
      "action": "为院校实训解决方案建立包含定义、适用对象、产品组成、案例证据和 FAQ 的权威事实页，并补充 Organization 与 FAQPage 结构化数据",
      "expected_effect": "增加官方来源成为 AI 回答引用候选的概率",
      "measure": "使用冻结查询协议复查，目标是至少两个引擎出现经过验证的品牌相关引用",
      "confidence": "medium"
    },
    {
      "recommendation_id": "rec-citation-third-party",
      "priority": "P1",
      "dimension": "citation_quality",
      "business_context": "职业院校采购与方案比较",
      "finding": "当前可验证的独立第三方内容数量有限，品牌相关回答主要缺少外部来源支持",
      "source_ids": ["src-industry-report"],
      "observation_ids": ["obs-chatgpt-solution", "obs-deepseek-comparison"],
      "hypothesis": "缺少独立案例、评测和行业材料会限制模型形成稳定的第三方引用路径",
      "action": "优先补充可核验的院校案例、实施效果和第三方方案评测，并保持品牌事实与官网一致",
      "expected_effect": "提高独立来源覆盖和域名多样性",
      "measure": "下一轮复查至少出现两个不同独立域名，且引用均通过来源验证",
      "confidence": "medium"
    },
    {
      "recommendation_id": "rec-foundation-knowledge-graph",
      "priority": "P1",
      "dimension": "foundation",
      "business_context": "品牌实体与产品信息基础",
      "finding": "知识图谱识别状态尚未确认，内容基础仍有一个未知检查项",
      "source_ids": ["src-official-home"],
      "observation_ids": [],
      "hypothesis": "品牌实体、产品名称和组织关系缺少跨页面一致表达，可能影响实体识别",
      "action": "核查品牌名称、组织信息、产品实体和官方账号的一致性，并完成知识图谱与百科可识别性验证",
      "expected_effect": "减少内容基础未知项并增强品牌实体的一致表达",
      "measure": "下次审计将 knowledge_graph 从 null 更新为带来源的明确布尔值",
      "confidence": "medium"
    }
  ]
}
